<!ELEMENT concesionario (coche+)>
<!ELEMENT coche (codigo, marca, modelo, matricula, potencia, plazas, numero_puertas)>
<!ELEMENT codigo (#PCDATA)>
<!ELEMENT marca (#PCDATA)>
<!ELEMENT modelo (#PCDATA)>
<!ELEMENT matricula (#PCDATA)>
<!ELEMENT potencia (#PCDATA)>
<!ELEMENT plazas (#PCDATA)>
<!ELEMENT numero_puertas (#PCDATA)>
